{
  "schema_id": "https://schemas.reiyah.invalid/gate-a/1.2.0/transport-observation-fixture.schema.json",
  "target_schema_id": "https://schemas.reiyah.invalid/gate-a/1.2.0/transport-observation-fixture.schema.json",
  "artifact_version": "1.2.0",
  "fixture_id": "reiyah.fixture.governance.transport-observation-synthetic-baseline@1.2.0",
  "fixture_class": "known-good-governance",
  "mission_release_id": "reiyah.mission@1.1.0",
  "protocol_release_id": "reiyah.protocol.harbor-gate-a@1.2.0",
  "synthetic_fixture_only": true,
  "baseline_expected_outcome": "accepted",
  "publication_event_baseline_ref": {
    "fixture_id": "reiyah.fixture.governance.publication-event-synthetic-baseline@1.2.0",
    "path": "fixtures/v1.2/governance/publication-event-synthetic-baseline.json",
    "schema_id": "https://schemas.reiyah.invalid/gate-a/1.2.0/publication-event-fixture.schema.json",
    "sha256": "sha256:9bde9d519c58958d70e9acac87a6b369448de5c6cae0db5d024a648946b80408",
    "byte_size": 40106,
    "byte_binding_scope": "entire_typed_publication_baseline_file_bytes"
  },
  "publication_receipt_operand": {
    "source_fixture_id": "reiyah.fixture.governance.publication-event-synthetic-baseline@1.2.0",
    "source_record_pointer": "/publisher_receipt",
    "source_positive_fixture_id": "reiyah.fixture.governance-good.public-distribution-receipt@1.2.0",
    "artifact_id": "reiyah.artifact.public-distribution-receipt-1.2.0",
    "path": "gate/public-distribution-receipts/reiyah.public-distribution-receipt-1.2.0.json",
    "sha256": "sha256:ffffffffffffffffffffffffffffffffffffffffffffffffffffffffffffffff",
    "byte_size": 12000,
    "schema_id": "https://schemas.reiyah.invalid/gate-a/1.2.0/public-distribution-receipt.schema.json",
    "version": "1.2.0",
    "binding_scope": "synthetic_declared_event_artifact_operand_not_fixture_snapshot_bytes",
    "selected_topology": {
      "artifact_id": "reiyah.artifact.public-distribution-receipt-1.2.0",
      "receipt_id": "reiyah.public-distribution-receipt.gate-a-1.2.0-static-correction",
      "schema_id": "https://schemas.reiyah.invalid/gate-a/1.2.0/public-distribution-receipt.schema.json",
      "version": "1.2.0",
      "distribution_event_id": "reiyah.distribution-event.gate-a-1.2.0-static-correction",
      "published_repository_url": "https://github.com/manfromnowhere143/reiyah",
      "published_ref": "refs/heads/main",
      "published_git_commit": "1111111111111111111111111111111111111111",
      "published_index_ref": {
        "artifact_id": "reiyah.artifact.gate-a-index-1.2.0",
        "path": "gate/GATE_A_EVIDENCE_INDEX.json",
        "sha256": "sha256:aaaaaaaaaaaaaaaaaaaaaaaaaaaaaaaaaaaaaaaaaaaaaaaaaaaaaaaaaaaaaaaa",
        "byte_size": 200000,
        "schema_id": "https://schemas.reiyah.invalid/gate-a/1.2.0/gate-a-index.schema.json",
        "version": "1.2.0"
      },
      "validation_report_ref": {
        "artifact_id": "reiyah.validation-report.gate-a-1.2.0",
        "path": "gate/validation-reports/gate-a-validation-1.2.0.json",
        "sha256": "sha256:bbbbbbbbbbbbbbbbbbbbbbbbbbbbbbbbbbbbbbbbbbbbbbbbbbbbbbbbbbbbbbbb",
        "byte_size": 8192,
        "schema_id": "https://schemas.reiyah.invalid/gate-a/1.2.0/validation-report.schema.json",
        "version": "1.2.0"
      },
      "published_at": "2026-08-25T10:30:50Z",
      "recorded_at": "2026-08-25T10:31:30Z"
    }
  },
  "authorization_operand": {
    "fixture_operand_id": "reiyah.fixture-operand.transport.authorization.synthetic-governance",
    "fixture_role": "transport_observation_authorization",
    "target_schema_id": "https://schemas.reiyah.invalid/gate-a/1.0.0/transport-verification-record.schema.json#/$defs/transportObservationAuthorizationRecord",
    "artifact_path": "gate/transport-verification-authorizations/synthetic-governance.json",
    "sha256": "sha256:5555555555555555555555555555555555555555555555555555555555555555",
    "byte_size": 3072,
    "binding_scope": "synthetic_declared_event_artifact_operand_not_fixture_snapshot_bytes",
    "synthetic_fixture_only": true,
    "production_event_claimed": false,
    "authority_created": false,
    "record": {
      "schema_id": "https://schemas.reiyah.invalid/gate-a/1.0.0/transport-verification-record.schema.json#/$defs/transportObservationAuthorizationRecord",
      "schema_version": "1.0.0",
      "artifact_id": "reiyah.artifact.transport-observation-authorization-synthetic-governance",
      "authorization_id": "reiyah.transport-observation-authorization.synthetic-governance",
      "version": "1.0.0",
      "record_kind": "transport_observation_authorization",
      "authorized_transport_record_id": "reiyah.transport-verification.synthetic-governance",
      "distribution_event_id": "reiyah.distribution-event.gate-a-1.2.0-static-correction",
      "mission_release_id": "reiyah.mission@1.1.0",
      "protocol_release_id": "reiyah.protocol.harbor-gate-a@1.2.0",
      "repository_url": "https://github.com/manfromnowhere143/reiyah",
      "repository_ref": "refs/heads/main",
      "authorized_git_commit": "1111111111111111111111111111111111111111",
      "index_ref": {
        "artifact_id": "reiyah.artifact.gate-a-index-1.2.0",
        "path": "gate/GATE_A_EVIDENCE_INDEX.json",
        "sha256": "sha256:aaaaaaaaaaaaaaaaaaaaaaaaaaaaaaaaaaaaaaaaaaaaaaaaaaaaaaaaaaaaaaaa",
        "byte_size": 200000,
        "schema_id": "https://schemas.reiyah.invalid/gate-a/1.2.0/gate-a-index.schema.json",
        "version": "1.2.0"
      },
      "validation_report_ref": {
        "artifact_id": "reiyah.validation-report.gate-a-1.2.0",
        "path": "gate/validation-reports/gate-a-validation-1.2.0.json",
        "sha256": "sha256:bbbbbbbbbbbbbbbbbbbbbbbbbbbbbbbbbbbbbbbbbbbbbbbbbbbbbbbbbbbbbbbb",
        "byte_size": 8192,
        "schema_id": "https://schemas.reiyah.invalid/gate-a/1.2.0/validation-report.schema.json",
        "version": "1.2.0"
      },
      "authorizer_identity": "operator.synthetic-governance-authorizer",
      "authorizer_identity_authentication_state": "independently_authenticated",
      "authority_basis": "Synthetic fixture authority operand used only to test exact static transport-observation authorization resolution; it creates no real identity, authority, authorization, observation, or event.",
      "authorized_at": "2026-08-25T10:31:30Z",
      "valid_until": "2026-08-25T10:34:00Z",
      "authorization_scope": "one_independent_static_transport_observation",
      "single_use": true,
      "gate_a_acceptance_conferred": false,
      "ga17_status": "not_evaluated",
      "scientific_publication_acceptance_conferred": false,
      "scientific_support_claimed": false,
      "compliance_claimed": false,
      "runtime_execution_authorized": false
    }
  },
  "retained_evidence_operands": [
    {
      "fixture_operand_id": "reiyah.fixture-operand.transport.remote-response.synthetic-governance",
      "fixture_role": "remote_response_evidence",
      "target_schema_id": "https://schemas.reiyah.invalid/gate-a/1.0.0/transport-verification-record.schema.json#/$defs/retainedObservationEvidence",
      "payload_encoding": "utf-8",
      "payload": "{\"authority_created\":false,\"fixture_only\":true,\"observation\":\"synthetic remote response operand; no network response occurred\"}\n",
      "payload_sha256": "sha256:e86d654921ba1d3dca0ef0033c715a0cf52598304778040f4e30bca8874700fe",
      "payload_byte_size": 128,
      "payload_binding_scope": "utf8_payload_string_bytes",
      "synthetic_fixture_only": true,
      "independent_observation_occurred": false,
      "authority_created": false,
      "record": {
        "evidence_id": "reiyah.transport-evidence.synthetic-remote-response",
        "evidence_kind": "remote_response_capture",
        "path": "gate/transport-verification-evidence/synthetic-remote-response.json",
        "sha256": "sha256:e86d654921ba1d3dca0ef0033c715a0cf52598304778040f4e30bca8874700fe",
        "byte_size": 128,
        "media_type": "application/json",
        "captured_at": "2026-08-25T10:31:30Z",
        "source_endpoint": "https://github.com/manfromnowhere143/reiyah",
        "collection_method": "independent_https_fetch"
      }
    },
    {
      "fixture_operand_id": "reiyah.fixture-operand.transport.verification-transcript.synthetic-governance",
      "fixture_role": "verification_transcript_evidence",
      "target_schema_id": "https://schemas.reiyah.invalid/gate-a/1.0.0/transport-verification-record.schema.json#/$defs/retainedObservationEvidence",
      "payload_encoding": "utf-8",
      "payload": "synthetic fixture only; no remote fetch, independent observation, publication acceptance, or authority occurred.\n",
      "payload_sha256": "sha256:a634e89747946da6ffe2c21623ca1b7881880a8270153619b728fe6c02d3ccfb",
      "payload_byte_size": 113,
      "payload_binding_scope": "utf8_payload_string_bytes",
      "synthetic_fixture_only": true,
      "independent_observation_occurred": false,
      "authority_created": false,
      "record": {
        "evidence_id": "reiyah.transport-evidence.synthetic-verification-transcript",
        "evidence_kind": "verification_transcript",
        "path": "gate/transport-verification-evidence/synthetic-verification-transcript.txt",
        "sha256": "sha256:a634e89747946da6ffe2c21623ca1b7881880a8270153619b728fe6c02d3ccfb",
        "byte_size": 113,
        "media_type": "text/plain",
        "captured_at": "2026-08-25T10:34:00Z",
        "source_endpoint": "https://github.com/manfromnowhere143/reiyah.git",
        "collection_method": "independent_git_fetch"
      }
    }
  ],
  "transport_record_operand": {
    "fixture_operand_id": "reiyah.fixture-operand.transport.record.synthetic-governance",
    "fixture_role": "transport_verification_record",
    "target_schema_id": "https://schemas.reiyah.invalid/gate-a/1.0.0/transport-verification-record.schema.json",
    "artifact_path": "gate/transport-verification-records/synthetic-governance.json",